[
  {
    "id": "A-2",
    "title": "Elegant 2-Bedroom Suite",
    "description": "Sophisticated design with efficient use of space.",
    "areaM2": 110,
    "bedrooms": 2,
    "bathrooms": 1,
    "tourPath": "/data/tours/A-2",
    "imagePath": "/data/models/model-A-2.jpg",
    "rotation360": {
      "folder": "/data/models/model-A-2",
      "frameCount": 60,
      "filenamePattern": "model-A-2_{index}.jpg"
    }
  },
  {
    "id": "A-3",
    "title": "A Modern 3-Bedroom Apartment",
    "description": "Spacious design with comfortable spaces",
    "areaM2": 185,
    "bedrooms": 3,
    "bathrooms": 3,
    "tourPath": null,
    "imagePath": "/data/models/model-A-3.jpg"
  }
]